<?xml version="1.0" encoding="UTF-8"?>
<reputazioneC xmlns:xsi="http://www.w3.org/2001/XMLSchema-instance" xsi:noNamespaceSchemaLocation="commenti.xsd"><linker><ID_creatore>2</ID_creatore><ID_post>1</ID_post><ID_comm>1</ID_comm><voto><votoDato>3</votoDato><ID_votante>4</ID_votante></voto><voto><votoDato>5</votoDato><ID_votante>4</ID_votante></voto><voto><votoDato>1</votoDato><ID_votante>4</ID_votante></voto><voto><votoDato>5</votoDato><ID_votante>4</ID_votante></voto></linker><linker><ID_creatore>3</ID_creatore><ID_post>1</ID_post><ID_comm>2</ID_comm><voto><votoDato>3</votoDato><ID_votante>4</ID_votante></voto></linker><linker><ID_creatore>3</ID_creatore><ID_post>1</ID_post><ID_comm>3</ID_comm></linker><linker><ID_creatore>2</ID_creatore><ID_post>1</ID_post><ID_comm>4</ID_comm></linker><linker><ID_creatore>3</ID_creatore><ID_post>1</ID_post><ID_comm>5</ID_comm></linker><linker><ID_creatore>2</ID_creatore><ID_post>1</ID_post><ID_comm>6</ID_comm><voto><votoDato>1</votoDato><ID_votante>3</ID_votante></voto><voto><votoDato>1</votoDato><ID_votante>4</ID_votante></voto><voto><votoDato>1</votoDato><ID_votante>4</ID_votante></voto></linker><linker><ID_creatore>3</ID_creatore><ID_post>3</ID_post><ID_comm>1</ID_comm><voto><votoDato>3</votoDato><ID_votante>4</ID_votante></voto></linker><linker><ID_creatore>1</ID_creatore><ID_post>3</ID_post><ID_comm>2</ID_comm><voto><votoDato>4</votoDato><ID_votante>3</ID_votante></voto></linker><linker><ID_creatore>3</ID_creatore><ID_post>7</ID_post><ID_comm>1</ID_comm><voto><votoDato>5</votoDato><ID_votante>4</ID_votante></voto><voto><votoDato>1</votoDato><ID_votante>4</ID_votante></voto></linker></reputazioneC>
